title,writer,pub_date,category,content,url,keywords
철학자 최진석 “농업의 미래는 디지털 혁신에 달렸다”,정혁훈 기자moneyjung@mk.co.kr,2025-04-10 23:27:36,경제,"“농업에 디지털 기술을 접목하면 그동안 불가능했던 환경 제어와 예측이 가능해진다. 따라서 농업의 미래는 디지털을 얼마나 적극적으로 활용하느냐에 따라 결정될 것이다.”

철학자 최진석 새말새몸짓 이사장은 10일 서울 양재동 aT센터 그랜드홀에서 열린 ‘디지털농업 심포지엄’에서 이 같이 말했다. 이번 심포지엄은 매일경제 애그테크혁신센터와 한국농업기술진흥원, 한국벤처농업대학이 공동 개최했다. 농업계와 투자업계, ICT업계 등 각계에서 200여 명이 참석하는 등 큰 관심 속에 진행됐다.

이날 심포지엄에 기조강연자로 나선 최 이사장은 ‘인문학자가 보는 농업 혁신’을 주제로 한 연설에서 “전통적인 농업에서 생산자들은 다른 분야에 비해 제어와 예측이 제한되는 특수성 때문에 항상 불안정할 수밖에 없었지만 이제는 디지털 기술을 활용한 혁신을 통해 많은 것을 해결할 수 있게 되었다”고 말했다.

최 이사장은 이날 농업에서의 디지털 혁신에 대해 많은 의미를 부여했다. 그는 “우리나라 농업이 안고 있는 많은 문제들이 어디에 기인하고 있는가를 분석해보면 전통적인 농업의 특수성에 갇혀 있기 때문으로 보인다”며 “이는 지금 세상이 어떻게 변화하고 있는지에 대해 눈과 귀를 닫고 과거부터 숭배해오던 농업의 우상을 깨뜨리지 못했기 때문에 나타난 것으로 봐야 할 것”이라고 지적했다. 최 이사장은 “지금 우리 농업의 문제점들은 그동안 해오던 일을 아무런 변화 없이 그대로 계속하다가 만나는 것들”이라며 “한마디로 혁신하지 않아서 맞닥뜨리게 된 문제들”이라고 일갈했다.

그러나 지금의 우리는 그러한 문제를 해결하려는 노력에 적극적이지 않다고 지적했다. 최 이사장은 “안타깝게도 우리나라는 혁신에 그다지 적극적이지 않고, 심지어는 우리나라에서는 혁신이 멈춰 있다고도 볼 수 있는 상황”이라며 “바로 지금 우리가 해야 할 일은 디지털에 대한 친화력, 혁신에 대한 감수성을 높이는 것”이라고 강조했다. 그는 “농업에서 디지털 혁신은 해도 되고 안해도 되는 문제가 아니라 우리가 미래 성장과 발전을 해나가기 위해서는 물론이고 생존을 하기 위해서라도 반드시 해야 할 일”이라고 힘줘 말했다.

최 이사장은 정혁훈 농업전문기자가 진행한 토론에서는 호기심의 관점에서 혁신을 풀이해 참석자들로부터 많은 호응을 얻었다. 그는 ‘농업에서 디지털 혁신을 잘해 나가기 위해서 필요한 건 99%의 노력에 더해 1%의 영감을 얻는 것이라고 하는데, 그 1%의 영감을 얻으려면 어떻게 해야 하느냐’는 질문에 대해 꼰대와 청춘을 비유해 설명하기 시작했다.

최 이사장은 “혁신이라는 주제를 놓고 보면 대개 꼰대는 혁신을 막는 역할을 하고 청춘은 혁신을 하는 역할을 한다”며 “꼰대와 청춘을 나누는 가장 큰 기준 중 하나는 호기심보다 당연한 게 많으면 꼰대이고, 당연한 것보다 호기심이 많으면 청춘”이라고 설명했다. 그는 “철학자 니체는 인간이 늙어간다는 것은 호기심의 불꽃이 줄어드는 것이라고 했다”며 “어린 아이들은 호기심 덩어리이지만 어른이 되면서 점점 당연한 것이 많아지고 호기심이 줄어들지 않느냐”고 했다. “그래서 네가 누구냐 하는 말은 사실 너는 호기심이 있느냐 없느냐는 말과 같은 말”이라고 그는 덧붙였다.

최 이사장은 일본의 스시는 세계적인 외식 산업으로 성장한 반면 한국의 비빔밥은 그렇지 못한 것도 호기심의 차이로 해석해 눈길을 끌었다. 그는 “스시는 쌀의 품종, 쌀알의 갯수, 손의 온도, 식초의 양 등 모든 것이 매뉴얼화 돼 있고 그 다음에 장인들의 개성이 반영되면서 매뉴얼을 뛰어넘는 스시가 나오지만 비빔밥은 세계화를 추진한다고 하면서도 그런 매뉴얼이 없다”며 “그건 똑같은 밥이지만 그 밥을 알려고 했느냐, 그 밥을 호기심의 대상으로 삼았느냐의 차이에 따른 것이며, 결국 그 밥이 산업이 될 수 있느냐 없느냐를 가르게 된다”고 말했다. “이를 다른 말로 표현하면 새로운 기술과 자기 자신에 대해 호기심이 있느냐 없으냐의 문제이며 또 다른 말로는 혁신을 하느냐 안하느냐의 문제”라고 덧붙였다.

최 이사장은 “좋은 영감이 올 때까지 기다리느라 작품 활동을 안 한다고 하는 예술가가 있다면 그건 예술가의 생명이 끝난 것이라고 생각한다”며 “영감이라는 것은 자기자신에게만 있는 호기심을 끝까지 집요하게 발휘했을 때 나오는 어떤 선물 같은 것”이라고 말했다. 그는 “토머스 에디슨이 99%의 노력과 1%의 영감을 말한 것은 99%의 노력을 한 뒤에야 1%의 영감이 온다는 뜻에서 말한 게 아닌가 싶다”며 “분명한 것은 이 세상에 존재하는 모든 새로운 것들은 영감의 결과이며, 그 영감은 호기심에서 온다”고 강조했다. 최 이사장은 “비빔밥이 세계화, 산업화되지 않은 것은 거기에 호기심을 두지 않았고, 그에 따라 영감이 나오지 않았기 때문일 것”이라며 “농업의 디지털 혁신을 위해 우리는 끊임없이 호기심을 가져야 할 것”이라고 당부했다.",https://www.mk.co.kr/news/economy/11288671,"이사장은, 이라고, 그는, 혁신을, 디지털"
"“코인 송금, 이제 은행서 해보세요”…금융권, 스테이블코인부터 속도 낸다","박인혜 기자inhyeplove@mk.co.kr, 박나은 기자nasilver@mk.co.kr",2025-04-10 22:57:21,경제,"스테이블코인을 비롯한 디지털 자산 시장을 활용하기 위한 은행권의 움직임이 속도를 내고 있다. 스테이블코인은 가치가 달러나 원 등 법정화폐에 연동된 코인을 말한다.

10일 금융권에 따르면 신한·NH농협은행과 케이뱅크는 국내 최초로 원화 기반의 스테이블코인을 활용해 해외 송금을 하는 테스트에 참여하기로 했다. 일본 프로그맷과 한국 페어스퀘어랩, 한국디지털자산수탁(KDAC)이 주최한 ‘팍스 프로젝트’에 참여하는 방식이다. 프로그맷은 일본 대형 금융기관 등이 공동으로 설립한 가상자산 인프라스트럭처 기업이다.

원화 기반의 스테이블코인으로 국가 간 송금 테스트에 나선다. 이를 통해 비용 절감, 처리 시간 단축, 결제 안정성 확보 등 법적·기술적 개선 방안을 모색하는 식이다. 현재 은행에서 달러 등을 송금하려면 1%대 수수료를 내야 하고, 수취 기간도 상당히 소요된다. 스테이블코인을 활용하면 송금에 소요되는 시간은 1~2분에 불과하고, 수수료도 상대적으로 낮아질 수 있다. 또 코인의 가장 문제점인 큰 변동성도 달러나 국채 등과 연동된 스테이블코인을 활용하면 어느 정도 해결이 가능하다. 은행들이 이 시장에 눈독을 들이는 것도 이 같은 이유에서다.

하나은행은 이와 별도로 이호성 행장 주도로 스테이블코인 거래 플랫폼을 구축하기 위한 스터디와 준비에 착수했다. 스테이블코인은 가치가 통화 등에 연동되는 만큼 은행에서도 뛰어들 만한 사업으로 보고 스테이블코인 발행과 유통이 모두 가능한 플랫폼 구축을 준비하는 것이다. 이 행장의 지시로 하나금융연구소와 디지털 부문에서 국가별 입법 현황과 글로벌 시장 등도 모니터링하고 있다.

하나은행 관계자는 “디지털 자산이 점점 더 많이 활용될 수밖에 없는 상황에서 은행이 진출할 만한 분야가 스테이블코인 시장”이라면서 “증권 회사의 홈트레이딩시스템(HTS)처럼 스테이블코인 거래 플랫폼을 만드는 것이 목표”라고 말했다. 다만 아직 관련 제도나 규제가 없는 상황이라 구체적으로 움직이기보다는 준비를 하고 있다가 상황이 무르익으면 뛰어들겠다는 뜻으로 보인다.

KB국민은행도 2023년 2월 시작된 ‘스테이블코인 실험 및 NFC 운영’을 통해 ‘국민지갑’ 가입자 60만명에게 스테이블코인 240억개를 발행한 경험이 있다. 국민은행 측은 “국민지갑 가입자에게 스테이블코인을 발행하고, KB금융 스타챔피언십 초청권을 NFC 형태의 디지털 교환권으로 교부하는 등 경험을 통해 스테이블코인 발행·유통·운용·소각 등 전 과정을 경험했다”며 “현재 한국은행의 중앙은행 디지털 화폐(CBDC) 사업에 적극 참여하면서 자체 서비스도 추가로 발굴할 예정”이라고 밝혔다.

은행들은 한은과 같은 중앙은행이 주도하는 CBDC에도 참여하고 있다. 현재 ‘프로젝트 한강’이라는 이름으로 테스트에 들어간 한은의 CBDC 사업에는 국민·신한·하나·우리·농협·BNK부산·IBK기업은행 등 7개 은행이 참가해 테스트 사업을 진행 중이다. 편의점과 배달앱 등에서 CBDC를 활용해 결제가 가능하게 한 것이다. 국제결제은행(BIS)이 시도하는 ‘아고라 프로젝트’에도 국민·신한·하나·우리·농협·기업은행이 참여하고 있다.

은행들은 토큰증권 사업에도 관심을 보이고 있다. 토큰증권이란 분산원장기술을 활용해 자본시장법상 증권을 디지털화한 것이다. 부동산, 고가의 시계, 미술품 등 자산은 물론 음악과 같은 지식재산까지 거래할 수 있다. 우리은행은 이 분산원장기술을 금융 상품에 적용하는 방안을 검토해왔고, 조각투자사들과도 적극적으로 협업해 자산의 디지털화를 추진 중이다.

농협은행 역시 사내에 별도 블록체인 관련 기술을 다루는 팀을 두고 적극 나서고 있다. 올해 취임한 강태영 농협은행장이 사내 대표적인 디지털 관련 전문가라는 점도 농협은행의 관련 행보가 빨라질 것이라는 관측에 힘을 싣는다. 농협은행은 작년 과학기술정보통신부가 주관한 블록체인 민간 분야 집중·확산 사업자로 선정돼 일단 토큰증권 발행 플랫폼 구축을 완료한 상태다.",https://www.mk.co.kr/news/economy/11288659,"있다, 스테이블코인, 디지털, 스테이블코인을, 관련"
美 관세에 대응할 韓 비장의 카드는 조선·LNG…비관세 장벽 개선도 협상카드,"신유경 기자softsun@mk.co.kr, 안정훈 기자esoterica@mk.co.kr",2025-04-10 22:23:26,경제,"미국의 상호관세 전격 유예로 시간을 벌게 된 정부가 본격적으로 대미 협상 전략 마련에 나섰다.

최근 도널드 트럼프 미국 대통령과 통화하며 관세협상을 진두지휘하고 있는 한덕수 대통령 권한대행 국무총리는 10일 주미대사, 방미 중인 통상교섭본부장과 화상회의를 열며 대응책 마련에 속도를 내고 있다. 피해가 예상되는 업종에 대한 지원책도 잇달아 내놓을 계획이다.

한 권한대행은 이날 도널드 트럼프 미국 행정부가 25%의 상호관세 부과를 석 달간 유예한 데 대해 “다소 위안이 되는 소식”이라며 “앞으로 90일 동안 모든 협상에 진전을 보여 이러한 관세의 부담으로부터 벗어나도록 노력해야 되겠다”고 했다.

정부는 조선·에너지 분야 협력, 비관세장벽 개선, 대미 수입 품목 확대 등 다양한 협상 카드를 활용한다는 방침이다.

한 권한대행은 아울러 이번 협상을 국내 세제, 비관세장벽, 위생 등을 개선하는 계기로 삼아야 하며 단순 협상용이 아닌 국내 기업을 위한 규제 개혁 동력으로 이어 가야 한다고 강조했다.

한 권한대행은 미국의 상호관세와 관련해 “우리나라의 관세 수준, 여러 가지 세제·세금 수준, 비관세장벽, 위생 이런 것들이 다 포함된다”며 “우리의 규제가 완화되면 외국 기업뿐만이 아니라 우리나라 기업에도 도움이 되는 부분이 많다”고 덧붙였다.

한 권한대행은 이날 조현동 주미대사, 방미 중인 정인교 산업통상자원부 통상교섭본부장 등과 화상회의를 열어 대미 관세협상 진행 내용을 보고받고 대응 전략을 점검했다.

정 본부장은 방미 중 제이미슨 그리어 미국 무역대표부(USTR) 대표, 윌리엄 키밋 상무부 국제무역 차관 내정자, 제프리 케슬러 상무부 산업안보국(BIS) 차관 등을 면담했다. 정 본부장은 그리어 USTR 대표와는 두 번째 만나 한국에 대한 관세율을 낮추기 위한 한국 측 입장을 전달했다.

조 대사는 “한 권한대행과 트럼프 대통령 간 통화 이후 만나본 미국 측 관계자들 모두 ‘정상 간 통화가 매우 긍정적이었으며, 조선·에너지·무역 분야에 대해 한국 측과 더 긴밀히 소통하겠다’는 반응을 보였다”고 보고했다.

정 본부장은 그리어 USTR 대표 등과 협의한 내용에 대해 보고하면서 “한간 정상 간 통화가 양국 간 협상의 시작을 촉진하는 중요한 계기가 됐음을 이번 협의에서 알게 됐다”며 “남아 있는 기간 동안에도 미국 측과 적극적으로 협의하겠다”고 했다.

한 권한대행은 주미 한국대사관이 미 국가안보회의(NSC), 국무부, 상무부 등 관련 기관과 적극 소통하고 협의해줄 것을 당부했다고 총리실은 전했다.

정부는 상호관세뿐 아니라 철강·자동차·반도체 등 품목 관세에 대한 대응책도 고심 중이다. 철강과 자동차 관세는 이미 발효됐고 미국은 앞서 반도체를 상호관세 부과 대상에서 제외하는 대신 25%의 품목 관세를 매기겠다고 예고한 바 있다.

안덕근 산업부 장관은 이날 종합 반도체 기업, 팹리스 기업, 소재·부품·장비(소부장) 기업, 한국반도체산업협회가 참석한 가운데 업계 간담회를 열어 미국의 관세 조치에 따른 영향과 대응 방안을 논의했다.

업계는 단기적으로 관세 영향은 제한적일 것이라고 전망하면서도 통상환경 급변에 따른 불확실성을 우려했다. 정부는 통상 리스크에 대응해 관계 부처 협의를 거쳐 반도체 지원 방안을 조만간 수립·발표하겠다고 강조했다.

정부는 지원책의 일환으로 반도체 기업을 대상으로 관세·원산지 등의 컨설팅을 지원할 예정이다. 수입에 의존하는 소재·부품에 대한 비용 부담을 경감할 수 있는 다양한 대책도 검토한다.

또 기업의 투자를 촉진하기 위해 기반시설을 지원하고 규제를 개선한다.

용인 반도체 클러스터 조성을 위해 전력·폐수 등 기반시설에 대한 정부 지원 한도 상향을 추진한다. 송전망 지중화 비용 분담 등 추가 재정 지원책을 준비하고 반도체 제조시설에 대한 분산에너지 설비 설치 의무 적용 완화도 검토한다.

정부는 관세전쟁에 효과적으로 대응하기 위해 반도체 생태계 전반의 경쟁력을 키우겠다는 목표다. 이를 위해 상반기 중 ‘트리니티 팹’ 운영법인을 설립해 팹 구축에 본격 착수한다. 트리니티 팹은 반도체 소부장 기업을 위한 첨단 반도체 테스트베드다. 산업부는 이 밖에 첨단산업 특화단지 전용 대규모 연구개발(R&D) 사업을 추진할 예정이다.",https://www.mk.co.kr/news/economy/11288640,"반도체, 대한, 권한대행은, 미국, 정부는"
"“어지러울 정도”…뛰었다 내렸다 반복하는 원화값, 변동성 4배로 커져",김정환 기자flame@mk.co.kr,2025-04-10 22:00:33,경제,"미국 상호관세 충격이 금융시장을 혼돈으로 몰아넣자 이달 달러당 원화값 변동성이 전월 대비 4배 껑충 뛰었다.

전문가들은 미·중 통상전쟁 향방과 미국과 개별국 간 관세 협상에 따라 당분간 이 같은 널뛰기 장세가 이어질 것으로 내다봤다. 국내 기업의 올해 수출·경영 전략 수립에도 혼선이 불가피해졌다.

서울 외환시장에서 달러당 원화 가치는 10일 주간거래를 전일 대비 27.7원 오른 1456.4원에 마감했다. 원화값은 7~9일 16.3원 미끄러지며 금융위기 이후 최저 수준인 1480원대 중반까지 추락했다가 이날 일부 낙폭을 되돌렸다.

도널드 트럼프 미국 대통령의 상호관세 유예 발표 소식에 금융시장에서 위험 선호 심리가 회복된 게 직접적인 원인이다. 국제 금융시장에서 위험 자산으로 분류된 원화 매수세가 이어졌고, 외국인도 국내 증시에서 주식을 쓸어 담으며 원화 가치를 끌어올렸다.

문제는 방향이 아니라 진폭이다. 해외 변수에 따라 원화값이 심하게 롤러코스터를 타며 시장 혼란이 증폭되고 있다.

한국은행과 서울외국환중개에 따르면 이달 들어 10일까지 원화값은 주간거래 종가 기준으로 하루 평균 14.7원의 진폭을 보였다. 지난달(4.3원)에 비하면 변동폭이 4배가량 커졌다.

하루 원화값 변동폭이 지난해 12월 이후 꾸준히 5원대를 유지했다는 점에 비춰봐도 움직임이 컸다.

백석현 신한은행 이코노미스트는 “트럼프 1기 행정부 때도 무역분쟁과 합의 과정에서 수개월에 걸쳐 원화값 변동성이 커졌다”며 “당분간 원화값이 1430~1480원대에서 등락을 거듭할 것”이라고 내다봤다.

‘환율 지진’이 심해지며 기업 원가, 소비자물가 등 경제 불확실성이 덩달아 커질 것이라는 우려도 나온다. 한 중견기업 관계자는 “하루가 다르게 원화값이 달라져 어디에 기준을 잡고 수출 대응 방안을 짜야 할지 혼란스럽다”고 분위기를 전했다.

박용갑 더불어민주당 의원이 한국무역협회 국제무역통상연구원에 의뢰해 ‘원·달러 환율 상승에 따른 산업별 생산비 영향’을 분석한 결과에 따르면 원화값이 1500원까지 낮아지면 전체 산업 생산비용은 4.4% 증가할 것으로 예측됐다. 업종별로는 제조업 생산비 증가분이 6.5%로 가장 높았고 건설업(3.3%), 서비스업(2.2%)이 뒤를 이었다.

무협은 “우리나라는 원자재 대부분을 수입에 의존하고 있어 원화값이 하락하면 기업의 원화 기준 수입 가격이 상승해 부담이 가중된다”며 “생산비용 증가분을 제품 가격에 반영하지 못하면 채산성이 악화되고, 반영하면 가격경쟁력이 약화되는 딜레마에 봉착하게 된다”고 분석했다.",https://www.mk.co.kr/news/economy/11288633,"원화값이, 원화, 원화값, 3원, 것으로"
"“한국을 알려야 한다”...대한해협 건너편, 고국사랑 진심이었던 그 사람","이승훈 기자thoth@mk.co.kr, 박인혜 기자inhyeplove@mk.co.kr",2025-04-10 21:32:58,경제,"오는 13일 일본 오사카에서 개막하는 ‘오사카·간사이 만국박람회(오사카 엑스포)’ 한국관에는 특별한 전시물이 있다. 한국관 전시실은 20분 정도 체험할 수 있는 3개 공간으로 구성됐는데, 마지막 공간에서 출구로 나오면 ‘재일동포 지원 기념 월’을 마주할 수 있다.

한국관 관계자는 “체험 공간도 중요하지만 이를 가능하게 한 것이 이분들의 차별과 억압 속에 빛난 고국 사랑이었다는 점을 강조하기 위해 제일 마지막 장소에 이를 배치했다”고 말했다.

기념비에는 한국 경제 산업 발전과 양국 관계에 기여한 재일동포의 역할과 공헌에 관한 내용이 한국어·일본어·영어로 나란히 소개돼 있다. 모든 내용의 중심에는 2011년 작고한 이희건 전 신한금융 명예회장이 있다.

오사카 엑스포는 1970년에도 열렸다. 당시 우리 국력 수준을 고려할 때 엑스포 참가는 엄두도 못 낼 상황이었다. 올해 엑스포에 159곳이 참가한 반면 당시 엑스포는78곳이 전부였다.

어려운 경제 상황에서도 한국관 설립이 가능했던 것은 재일동포 덕분이다. 이들은 한국을 세계에 알려야 한다는 일념하에서 후원회를 결성하고 한국관 건설에 필요한 비용의 절반을 기부했다.

당시 기부액은 2억2000만엔, 현재 기준으로 환산하면 500억원 이상의 가치가 있는 금액이다. 재일동포의 후원으로 건축가 김수근이 설계한 15개 열주가 늘어선 한국관은 당시 엑스포에서 화제가 된 건물 중 하나로 꼽힌다.

이를 진두지휘한 것이 당시 오사카 재일동포의 중심이자 ‘보스’로 불리던 이희건 전 회장이다. 어려운 가정의 차남으로 태어나 15세에 일본으로 건너간 그는 수완을 발휘해 건실한 사업체를 일궈냈다.

하지만 주변의 재일동포가 일본에서 은행을 이용하기 어려워 사업이 힘들다는 점을 느끼고 금융업에 뛰어들어 1956년 오사카흥은을 설립했다.

오사카흥은은 재일동포 사업의 마중물이 돼줬고 오사카 지역 내 한인 사회는 크게 성장할 수 있었다. 이후 이 전 회장은 고국에서도 금융업을 통해 기여할 수 있는 방법을 계속해서 찾았고, 이는 1982년 신한은행 설립으로 이어진다.

연설이 청산유수 같고 성격이 괄괄해 남들을 리드해왔던 이 전 회장은 1964년 도쿄올림픽 때에도, 1988년 서울올림픽 때에도 고국 지원의 중심에 있었다. 도쿄올림픽 때는 한일 국교 정상화 전인데도 불구하고 일본 정부의 차가운 눈길을 피해 올림픽에 참가한 한국 선수들의 모든 경비를 책임졌다.

서울올림픽 개최를 위해 조직한 후원회 회장도 당연히 이 전 회장의 몫이었다. 당시에는 ‘고국에 경사가 났다’며 기쁨의 눈물을 훔치면서 쌈짓돈을 기부한 재일동포가 10만명에 달했다.

이들의 기부액은 총 100억엔, 당시 환율로는 540억원에 달한다. 서울 올림픽공원에 세워진 대부분의 건물이 재일동포 기부금으로 지어졌을 정도다.

1970년 오사카 엑스포 이후 55년 만에 다시 엑스포가 열린다. 이 전 회장이 설립한 한일교류재단은 이번에도 한국관 건립에 3억원을 쾌척했다. 고국의 경제력을 감안하면 적은 금액일 수도 있지만 그들의 고국 사랑은 결코 중단되지 않은 것이다.

최근 일본에 한식 붐이 크게 불고 있는데 그 시작을 1992년 이 전 회장이 시작한 ‘바이 코리안 운동’에서 찾는 사람들이 많다. 일본 현지에서 한국산 제품 사기 운동을 벌였고, 이것이 1990년대 중반부터 일본에 불어닥친 한국 김치·라면 붐으로 이어졌다는 것이다.

진창수 주오사카총영사는 “도쿄의 대사관과 오사카총영사관 등 일본 내 주요 공관 대부분이 재일동포가 억압과 차별 속에서 힘들게 번 돈으로 지어졌다”며 “다음달 열리는 엑스포 한국의 날에 이들에 대한 감사의 의미를 담은 행사를 준비하고 있다”고 말했다.",https://www.mk.co.kr/news/world/11288627,"당시, 오사카, 있다, 한국관, 엑스포"
