title,writer,pub_date,category,content,url,keywords
“단종 전 꼭 만들라”…선수가 추천하는 신용카드는,박나은 기자nasilver@mk.co.kr,2025-04-11 00:48:09,경제,"카드고릴라가 단종 전 챙겨야 할 ‘아시아나 마일리지 카드’ 4종을 11일 공개했다.

4종의 카드는 올해 1분기 고릴라차트를 기반으로 선정됐다. 고릴라차트는 카드고릴라 웹사이트(PC, 모바일 통합)에서 집계된 각 신용카드 상품 조회수 및 신청 전환수를 기준으로 매겨지는 인기 순위다.

우선 올해1분기 아시아나 마일리지 카드 1위 자리에는 ‘아시아나 신한카드 Air 1.5’가 올랐다. 높은 마일리지 적립률로 인기를 끌었던 이 카드는 오는 30일 발급 종료된다. 이용금액 1000원 당 1.5마일이 기본 적립되고, 해외 가맹점에서는 1000원당 1.5마일이 추가 적립돼 총 3마일이 적립된다. 해외겸용 연회비 4만5000원이다.

차트인 한 카드 중 가성비 1위로는 BC카드의 ‘BC바로 에어 플러스 아시아나’가 꼽혔다. 이용금액 1000원당 1.3마일이 적립되고, 카드사용액 100만원당 300마일이 추가 적립된다. 국내 모든 가맹점에서 5만원 이상 결제 시 최대 3개월 무이자할부도 제공한다. 연회비 1만9000원으로 가성비 마일리지 카드로 입소문 났던 이 카드 역시 오는 30일 발급이 종료된다.

적립 마일리지 1위 카드로는 삼성카드의 ‘아시아나 삼성애니패스플래티늄카드’와 ‘아시아나 삼성지엔미플래티늄카드’가 꼽혔다. 두 카드 모두 이용금액 1000원당 1마일이 적립되고, 스타벅스, 커피빈, 파스쿠찌, 투썸플레이스, 탐앤탐스 등 5개 커피전문점에서는 1000원당 5마일이 적립된다. ‘아시아나 삼성애니패스플래티늄카드’의 경우 음식점에서, ‘아시아나 삼성지엔미플래티늄카드’의 경우 온라인 쇼핑몰 및 홈쇼핑에서 이용 시 1000원당 2마일이 적립된다.

고승훈 카드고릴라 대표는 ""아시아나항공 마일리지 카드의 경우 대한항공 마일리지 카드 대비 이용금액 당 마일리지 적립 비율이 높아 소비자 사이에서 인기였다”며 “합병 이후 마일리지 통합 비율 등 정책이 아직 발표되지 않았으나, 카드 유효기간까지는 서비스가 제공되는 만큼 자신에게 맞는 알짜카드는 챙겨두는 것이 좋다”고 말했다.",https://www.mk.co.kr/news/economy/11288779,"마일리지, 아시아나, 카드, 1000원당, 이용금액"
“제2의 이창호는 바로 나”...676명 바둑 꿈나무 몰려간 이곳,김정환 기자flame@mk.co.kr,2025-04-11 00:45:59,경제,"하나은행이 바둑 저변 확대를 위해 전국 어린이들을 대상으로 ‘2025 하나은행 어린이 바둑 페스티벌’을 연다고 11일 밝혔다.

초등학생과 미취학 아동 등 바둑 꿈나무들이 한자리에 모이는 이번 페스티벌은 다음달 24일 서울시립대학교 100주년 기념관 실내체육관에서 열린다. 17일부터 다음달 12일까지 하나은행 모바일 애플리케이션(앱) ‘하나원큐’에서 선착순으로 신청할 수 있고 참가비는 무료다.

예선부터 결승까지 하루 동안 진행되는 이번 페스티벌에는 최강부·유단자부·고급부·초중급부·5인 랜덤 단체전 등이 펼쳐진다. 미취학 아동을 위한 유치부까지 10개 부문에 출전할 어린이 바둑기사 676명을 모집한다. 참가하는 모든 어린이에게는 기념품이 제공되며 입상하는 어린이들에게는 트로피와 메달, 시상품이 주어진다.

‘한국 바둑의 전설’ 이창호 국수(國手)의 팬 사인회를 열고 대회 참가자 중 20명을 추첨해 이창호 국수의 휘호가 담긴 부채도 증정한다.",https://www.mk.co.kr/news/economy/11288775,"바둑, 다음달, 미취학, 어린이, 이번"
돈 급한데 신용점수 낮은 김 대리…‘이것’ 덕분에 대출 싸게 받는다는데,박나은 기자nasilver@mk.co.kr,2025-04-11 00:45:48,경제,"금융당국이 국내 가계대출 관리에 적극적으로 나서면서 금융사들도 대출 규모와 연체율을 관리하는 데 심혈을 기울이고 있다. 특히 제2금융권의 경우 신용점수가 낮은 이들이 대출시장에서 소외되지 않도록 대출을 공급하면서도 자산건전성 관리를 해야 하는 상황이다.

현대캐피탈의 자동차담보대출 상품은 캐피탈사의 대출 상품이지만, 기본 개인 신용에 자동차 담보를 추가해 대출금리도 일반 신용대출보다 낮고, 한도도 더 넉넉하다는 장점이 있다. 각 개인의 신용점수를 기반으로 한도가 책정되고, 여기에 자동차의 담보가치를 더해 추가 한도가 부여되는 방식이다.

이 같은 특장점이 부각되면서 최근 자동차담보대출은 중·저신용자와 소상공인 등에게 새로운 선택지가 되고 있다. 또 금융사들이 연체율 등 리스크 관리를 하는 데도 용이해 많은 제2금융권의 금융사들이 자동차담보대출의 비중을 늘리는 방향으로 상품 포트폴리오를 변화시켜 나가는 추세다. 자동차담보대출 시장이 꾸준히 성장하며 신용대출을 대체할 새로운 시장으로 자리잡아가고 있는 셈이다.

현대캐피탈은 국내 최초로 자동차담보대출 상품을 선보인 캐피탈사다. 고객의 신용점수에 고객이 보유한 차량의 담보 가치를 더해 일종의 신용보강을 한다. 이를 통해 기존 신용대출이나 중금리 상품보다 대출금리는 낮추고, 대출한도는 높이는 것이다.

실제로 신용대출 금리보다 자동차담보대출 금리가 3%포인트 이상 낮게 운영되고 있다. 게다가 고객의 차량을 담보로 하지만 차량은 이전과 동일하게 이용할 수 있어 장기화된 불황에 어려움을 겪고 있는 소상공인이나 대출이 필요한 직장인들도 차량 이용과 목돈 마련을 동시에 할 수 있다.

평균 15%를 웃도는 캐피탈과 카드업권의 신용대출 상품과 비교했을 때 상당히 큰 이자 비용을 아낄 수 있다. 상대적으로 신용점수가 낮은 2금융권 고객들에게는 상당한 혜택이다. 최저 금리는 4.9%이며, 대출한도 역시 현대캐피탈 신용대출 한도에 차량 가치를 더하기 때문에 최대 6000만원까지 넉넉하게 주어진다.

금리와 한도 조회, 대출신청 절차도 간소화했하다. 현대캐피탈의 공식 앱인 ‘현대캐피탈 카앤에셋’ 앱에서 차량 번호만 입력하면 금리와 한도 조회, 대출까지 3분 안에 가능하다. 영업점을 방문하거나 별도의 복잡한 증빙서류를 제출할 필요도 없다. 특히 현대캐피탈 차량 할부 이용 이력이 있거나 현재 이용 중인 고객에게는 보다 좋은 한도와 금리 혜택도 제공된다.

현대캐피탈 관계자는 “자동차담보대출은 소비자들에게 합리적인 금융 혜택을 제공하고, 금융사 입장에서는 기존 신용대출보다 대출 리스크를 효율적으로 관리할 수 있게 해주는 장점을 지니고 있다”며 “고객들이 자동차담보대출 상품을 더욱 경제적이고 편리하게 활용할 수 있도록 상품을 발전시켜 나갈 것”이라고 밝혔다.

그는 이어 “주요 플랫폼 기업들과의 협업을 통해 2금융권 상품을 이용하고 있는 고객들이 자동차담보대출을 대환대출 상품으로 활용할 수 있는 방안을 확대해 나가고 있다”며 “고객들이 이자 감면 혜택을 받을 수 있는 다양한 프로그램을 지속적으로 개발해 나갈 예정”이라고 강조했다.",https://www.mk.co.kr/news/economy/11288774,"있다, 있는, 자동차담보대출, 상품을, 차량"
주말에도 외국어 전화 상담…외국인 고객 서비스 확대하는 은행은,박인혜 기자inhyeplove@mk.co.kr,2025-04-11 00:39:55,경제,"신한은행이 12일부터 외국인 고객의 편의성을 높이기 위해 외국어 고객상담센터의 영어·베트남어·러시아어 상담서비스를 주말에도 제공한다.

신한은행은 지난 1월 ‘김해 외국인중심 영업점’을 오픈하고 외국인 고객에게 토요일 오전 9시에서 오후 5시까지 디지털라운지 화상상담, 일요일 오전 9시에서 오후 6시까지 영업점 대면상담 서비스 등 주말에도 금융상담을 제공하고 있다.

이번 주말 확대는 외국인 중심 영업점 방문 고객의 다빈도 국가를 감안해 영어와 베트남어, 러시아어 등 3개 언어를 선정했다. 운영 시간은 오전 9시에서 오후 6시까지이며, 국번없이 1577-8380[해외에서 이용 시 : 82-2-3449-8330]으로 전화하면 이용 할 수 있다.

전화를 통해 환전이나 송금 등 외환 관련 문의를 할 수 있고, 인터넷뱅킹·신한 SOL뱅크·신한 SOL글로벌 등 주요 앱 사용안내와 외국고객 특화 점포 안내 등을 받을 수 있다.

신한은행 외국어 고객상담센터는 은행권 최대인 10개 언어로 상담 서비스를 제공하고 있으며, 상담 가능 언어는 영어·일본어·중국어·베트남어·몽골어·태국어·러시아어·캄보디아어·필리핀어·인도네시아어다.",https://www.mk.co.kr/news/economy/11288763,"9시에서, 러시아어, 베트남어, 영업점, 오전"
빗썸이 구속된 전 대표한테 47억원을 줬다고?[엠블록레터],전성아 기자jeon.seonga@m-block.io,2025-04-11 00:07:37,경제,"[엠블록레터] 안녕하세요 엠블록레터의 AI 인턴입니다. 국내 가상자산 거래소 빗썸이 실적 호조 속에서 고액의 상여금과 고급 사택을 제공한 사실이 드러나 도덕적 해이 논란에 휩싸였습니다. 금품수수 혐의로 구속된 전 빗썸홀딩스 대표 이상준 씨에게 47억원을 지급한 것뿐만 아니라, 일부 임원에게 116억원 규모의 사택 보증금을 지원한 사실도 확인되며 회사 내부 통제와 윤리에 대한 비판이 제기되고 있습니다.

빗썸은 지난 3일 사업보고서를 통해 이 전 대표가 지난해 상여금 20억원과 퇴직소득 22억3천700만원, 급여 4억6천600만원 등 총 47억원을 수령했다고 밝혔습니다. 이 전 대표는 2021년 A코인을 상장해달라는 청탁과 함께 금품을 수수한 혐의로 재판을 받고 있으며, 1심에서 징역형과 추징금 5천만원을 선고받았습니다. 빗썸은 이 전 대표가 거래소 성장을 이끈 공로를 인정해 상여금을 지급했다고 설명했지만, 이 같은 금품 지급은 시장에서 큰 논란을 일으켰습니다.

또한, 빗썸은 전·현직 임원들에게 116억원 규모의 고급 사택 보증금을 제공한 사실도 드러났습니다. 금융감독원은 이를 적발하고 검찰에 수사 의뢰한 상태이며, 검찰은 이미 본사를 압수수색하고 본격적인 수사에 착수했습니다. 김대식 전 대표이사이자 현 고문은 회사로부터 11억원을 지원받은 뒤, 자신이 소유한 반포 아파트를 제3자에게 임대해 28억원의 보증금을 챙긴 것으로 알려졌습니다. 이러한 사익 추구 행위는 회사 내부의 견제와 통제 없이 이루어진 것으로 비판받고 있습니다.

빗썸은 “임직원 복지 및 핵심 인력 유지를 위한 사택 지원 제도를 운영해왔으나, 이번 금감원 지적에 따라 제도 전반을 전수조사 중이며 내부통제를 강화할 계획”이라고 밝혔습니다. 그러나 금감원의 조사 결과, 내부에서 이를 적절히 감시하지 않은 점은 회사의 관리 체계에 심각한 문제가 있음을 시사합니다.

이와 더불어 빗썸은 정관을 변경하여 ‘대부업 및 대부중개업’을 신규 사업목적으로 추가했습니다. 업계에서는 이를 ‘렌딩 서비스’와 연결시키려는 의도라는 해석이 나오고 있으며, 이는 이미 법적 규제의 사각지대에 놓여 있어 투자자 보호에 구멍이 생길 우려가 있습니다.

금융감독원은 이 문제에 대해 철저히 조사하고 있으며, 가상자산 업계 전반의 내부통제 실태를 점검하고 제도 개선을 추진할 계획입니다. 빗썸은 검찰 수사와 금감원 조사를 성실히 임하겠다고 밝혔지만, 회사의 신뢰 회복은 여전히 쉽지 않은 상황입니다. 지속적인 논란 속에서, 빗썸은 투명한 경영과 윤리적 책임을 다하는 기업으로서의 모습을 갖추기 위한 길을 고민해야 할 시점입니다. 이상 AI 인턴이었습니다.

Written by ChatGPT, edited by Mblock

전성아 엠블록 연구원(jeon.seonga@m-block.io), 김용영 엠블록 에디터(yykim@m-block.io)",https://www.mk.co.kr/news/economy/11288697,"빗썸은, 보증금을, 사택, 이를, 있습니다"
"트럼프발 관세 전쟁, 비트코인에 득일까 실일까?[엠블록레터]",김용영 기자yykim@m-block.io,2025-04-11 00:07:12,경제,"[엠블록레터] 도널드 트럼프 미국 대통령이 기본 10%, 국가별로 최대 50%에 육박하는 관세 부과 정책을 전면 선포하자 전세계 금융 시장이 발칵 뒤집혔습니다. 뉴욕 증시는 이틀 연속 5% 이상 폭락했고 코스피는 지난 7일 매도 사이드카가 발동되기도 했습니다. 암호화폐 시장에도 큰 영향을 미쳐 비트코인은 또다시 8만달러 저항선을 하향 돌파하는 결과를 낳았습니다.

하지만 비트코인이 어떤 코인인가요. 지금까지는 경제적 위기가 발생할 경우 매력이 부각되는 디지털 자산이었는데요. 이번에는 일단 증시 하락과 함께 동반 하락하는 현상을 보이고 있습니다. 트럼프발 관세 전쟁이 비트코인에게는 2023년 실리콘밸리 은행 파산 사태와 같이 득으로 작용할까요, 아니면 과거 코로나 사태처럼 실로 작용할까요? 하나씩 살펴보겠습니다.

트럼프가 촉발한 관세 전쟁은 글로벌 경제와 금융 시장에 큰 영향을 미치고 있습니다. 갑자기 관세가 기본 10%에서 최대 50%까지 부과되면 미국 내 수입품 가격이 급등해 소비가 위축될 것이며 이 때문에 미국을 대상으로 하는 수출품들은 판매 부진에 휩싸일 것이 불보듯 뻔하니까요. 국가를 넘나드는 무역시에 발생하는 관세로 각 국가별로 생산과 소비가 블록화될 가능성이 높아지고 그만큼 무역량은 줄어들며 따라서 자국 내 자급자족(?) 체계를 갖추지 않은 국가들은 필연적으로 영향을 받을 수밖에 없습니다.

이처럼 국가별 블록화가 진행될 경우 첫번째로 영향받는 자산은 통화입니다. 특히 무역이 줄어들면 전세계 무역의 기축통화라 할 수 있는 달러의 수요도 낮아져 달러 가치의 하락을 유발할 수 있겠죠. 과거에도 달러 가치에 의문부호가 붙었을 때 비트코인은 상승했습니다.

해외에서도 이같은 의견이 일부 제기되고 있습니다. 코인데스크에서는 글로벌 금융, 무역 시스템의 분산에 따라 달러에 대한 대안을 모색하는 움직임이 포착된다며 대표적인 사례로 금을 들었습니다. 금은 관세 전쟁 발발 이후 후 사상 최고가를 경신했으며 지속적인 강세 흐름을 보이고 있습니다. 골드만삭스 출신으로 현재 그레이스케일의 리서치 총괄을 맡고 있는 잭 팬들은 코인데스크와의 인터뷰에서 “관세가 달러의 지배적 역할을 약화시키고 비트코인을 포함한 경쟁자들에게 공간을 만들어줄 것”이라고 밝혔습니다.

하지만 지금 비트코인 가격만 보면 관세 전쟁이 결코 호재라고 할 수 없죠. 트럼프 당선 이후 심리적 저항선인 8만달러가 또 뚫렸습니다. 저항선 하향 이탈로 추가 하락을 예상하는 의견도 더 힘을 얻고 있습니다.

글로벌 규모의 경제 위기가 비트코인의 대안 자산 논리를 무력화시키는 경우는 바로 유동성이 고갈될 때입니다. 쉽게 말해 투자의 대안을 모색할수도 없을 만큼 상황이 나쁜 것이죠. 이럴 때 투자자들은 가장 확실한 자산인 현금을 들고 시장을 떠납니다. 이게 바로 유동성 고갈이고 시장 규모가 축소되는 것입니다. 가격 하락은 당연한 것이구요.

최근 며칠만 보면 전세계 금융 시장은 대안을 모색하기보다 일단 위험 자산에서 이탈하는 추세가 강한 것으로 보입니다. 전세계 증시가 동반 추락한 데다가 비트코인 가격도 10% 이상 떨어졌거든요. 게다가 유동성이 줄어들면 적은 매수와 매도로도 시장 가격에 미치는 영향이 커집니다. 변동성이 높아지는 거죠. 이는 자산의 불안정성을 높여 투자 심리를 더욱 위축시킵니다.

따라서 비트코인의 대안 자산 성격이 관세 전쟁 때 더욱 부각될 수 있다고 믿더라도 단기간의 위험자산 회피 추세는 흘려보내야 할 것입니다. 8만달러라는 저항선이 뚫린 이상 새로운 저점을 모색해야 하거든요. 크립토퀀트의 주기영 대표는 7만달러를 새로운 저점으로 제시했구요, 뉴욕 암호화폐 헤지펀드인 렉커 캐피털 설립자인 퀸 톰슨은 6만달러까지 하락할 수 있다고 밝혔습니다. 당분간은 추가 하락 가능성을 염두에 두고 지켜봐야 할 타이밍입니다.

김용영 엠블록 에디터(yykim@m-block.io), 전성아 엠블록 연구원(jeon.seonga@m-block.io)",https://www.mk.co.kr/news/economy/11288695,"관세, 있습니다, 금융, 전세계, 10"
제2금융권도 프리미엄 신용카드 경쟁 불붙나…상품 속속 출시,한상헌 기자aries@mk.co.kr,2025-04-10 23:59:03,경제,"제2금융권인 새마을금고에서 연회비가 10만원이 넘는 ‘프리미엄 카드’가 출시돼 눈길을 끈다. 저축은행, 신협 등 다른 제2금융권에서도 비슷한 상품이 출시될 수 있을지 주목된다.

10일 금융권에 따르면 하나카드와 새마을금고는 프리미엄 상업자 표시 신용카드(PLCC)인 ‘MG+ BLACK 하나카드’를 최근 출시했다. 카드는 프리미엄 혜택을 선호하는 손님을 위해 라이프스타일 전반에 걸쳐 고급화된 서비스를 제공한다. 해외여행, 쇼핑, 골프, 일상영역 청구할인 서비스, 10만원 상당 바우처 제공, 전세계 공항 라운지 무료 이용, 비자(VISA) 브랜드 서비스 등이 탑재돼 있다. 연회비는 12만원이다.

기존에도 신용카드 상품이 있었지만, 새마을금고에서 연회비 10만원 이상인 신용카드 상품이 나온 건 이번이 처음이다. 새마을금고 고객 수가 늘어나면서 다양한 상품 수요를 잡기 위한 포석이라고 해석된다. 현재 새마을금고는 신용카드 3종과 체크카드 12종을 취급하고 있다. 이중 ‘MG+ 신용카드 Primo 하나카드’는 연회비가 1만2000원에 불과하고, ‘MG+ Blue 하나카드’도 2만원에 그쳤다.

프리미엄 카드는 일반적으로 연회비 10~15만원 이상이지만, 여러 고급화된 서비스를 받을 수 있는 게 장점이다. 전체 신용카드 수에서 차지하는 비중도 작다. 신용카드 플랫폼 카드고릴라에 1022개 신용카드 상품 중 연회비가 10만원 이상인 상품은 133개로 약 13.0%에 불과하다.

저축은행, 신협 등에서도 프리미엄 신용카드를 원하는 수요가 높은 것으로 파악된다. 자산 규모도 성장하고 고객 수도 많아지면서 카드 사업 등 종합적인 금융서비스를 요구하는 목소리가 커지기 때문이다. 한편, 신용카드 사업 확대를 통해 고객 데이터 분석 등을 할 수 있는 것도 중요한 사업 포인트로 여겨지고 있다.

신협중앙회 관계자는 “모든 금융사들이 종합금융서비스를 제공하는 것을 목표로 하고 있다”며 “신용카드 사업이 금융업 내에서 데이터 파악 등에 효과적”이라고 말했다.",https://www.mk.co.kr/news/economy/11288692,"신용카드, 프리미엄, 있다, 10만원, mg"
